{
  "contract_version": 2,
  "suite": "sync_planner",
  "case_id": "pull_household_allowed_even_if_profile_dirty",
  "input": {
    "role": "member",
    "pull_requested": true,
    "debounce_ms": 2000,
    "now_ms": 1000,
    "household_dirty": false,
    "profile_dirty": true,
    "profile_changed_at_ms": 0,
    "profile_id": "p1",
    "addons": [],
    "settings": {
      "theme": " dark "
    },
    "catalog_prefs": {}
  },
  "expected": {
    "rpc_calls": [
      {
        "name": "get_household_addons",
        "params": {}
      }
    ]
  }
}
