{
  "contract_version": 2,
  "suite": "sync_planner",
  "case_id": "no_dirty_no_calls",
  "input": {
    "role": "owner",
    "household_dirty": false,
    "profile_dirty": false,
    "profile_id": "p1",
    "addons": [
      {
        "url": "https://example.com/manifest.json",
        "enabled": true,
        "name": "Example"
      }
    ],
    "settings": {
      "theme": "dark"
    },
    "catalog_prefs": {}
  },
  "expected": {
    "rpc_calls": []
  }
}
