{
  "contract_version": 2,
  "suite": "sync_planner",
  "case_id": "pull_household_when_clean",
  "input": {
    "role": "member",
    "pull_requested": true,
    "household_dirty": false,
    "profile_dirty": false,
    "profile_id": "p1",
    "addons": [],
    "settings": {},
    "catalog_prefs": {}
  },
  "expected": {
    "rpc_calls": [
      {
        "name": "get_household_addons",
        "params": {}
      }
    ]
  }
}
